fMRI-Based Machine Learning Analysis of Neural Substrates of Pediatric Anxiety: Temporal Pole and Emotional Face-Responses.,10.21203/rs.3.rs-120600/v1,n/a,Greiner R.,Research Square,2020,Canada,0
A manually denoised audio-visual movie watching fMRI dataset for the studyforrest project,10.6084/m9.figshare.10266554,n/a,Liu J.,Scientific Data,2019,China,2
Application of the sequential matrix diagonalization algorithm to high-dimensional functional MRI data,10.1007/s00180-019-00925-8,n/a,Redif S.,Springer,2020,Belgium,0
Clinical brain PET research must embrace multi-centre collaboration and data sharing or risk its demise,10.1007/s00259-019-04541-y,n/a,Červenka S.,Springer,2020,Sweden,5
Investigating inhibition deficit in schizophrenia using task-modulated brain networks,10.1007/s00429-020-02078-7,n/a,Biswal B.,Springer,2020,United States,0
Idiopathic and acquired pedophilia as two distinct disorders: an insight from neuroimaging,10.1007/s11682-020-00442-z,n/a,Camperio Ciani A.,Springer,2021,Italy,3
Diffusion-Weighted Imaging,10.1007/978-3-030-29184-6,n/a,Polzehl J.,Springer Nature Switzerland,2019,Germany,3
On Tensor Distances For Self Organizing Maps: Clustering Cognitive Tasks,10.1007/978-3-030-59051-2,n/a,Sioutas S.,Springer Nature Switzerland,2020,Greece,1
Perceived Image Reconstruction from Human Brain Activity via Time-Series Information Guided Generative Adversarial Networks,10.1007/978-3-030-63823-8,n/a,Zhang D.,Springer Nature Switzerland,2020,China,0
Modelling of Transcranial Magnetic Stimulation (TMS) Induced Fields in Different Age Groups,10.1007/978-3-030-65092-6_8,n/a,Croarkin P.,Springer Nature Switzerland,2021,United States,0
A generalizable method for automated quality control of functional neuroimaging datasets,10.1007/978-3-030-53352-6_6,n/a,Martin W.,Springer Science and Business Media Deutschland,2021,United States,1
EEG extended source imaging with structured sparsity and   L   1 -norm residual,10.1007/s00521-020-05603-1,n/a,Wang G.,Springer Science and Business Media Deutschland,2021,China,0
MULTIVARIATE STATISTICS AND DECODING FOR ELECTROENCEPHALOGRAPHIC DATA,n/a,https://libstore.ugent.be/fulltxt/RUG01/002/479/678/RUG01-002479678_2018_0001_AC.pdf,Marinazzo D.,thesis,2018,Belgium,0
On the Reproducibility and Interpretability of Group-Level Task-fMRI Results,10.31237/osf.io/mj7qa,n/a,Bowring A.,thesis,2019,United Kingdom,0
Brain regions and networks supporting working memory and selective attention processing in typically developing and extremely preterm-born children,10138/319865,https://helda.helsinki.fi/bitstream/handle/10138/319865/tokariev_maksym_dissertation_2020.pdf?sequence=1&isAllowed=y,Tokariev M.,thesis,2020,Finland,0
Inter-group Heterogeneity of Regional Homogeneity (REHO),n/a,https://www.ubishops.ca/wp-content/uploads/jiang20201212-updated.pdf,Jiang,thesis,2020,Canada,0
On the analysis of layer-specific fMRI,n/a,https://repository.ubn.ru.nl/bitstream/handle/2066/197552/197552.pdf,"Van Mourik, T",thesis,2018,Netherlands,0
Interpretation of Human Behavior from Multi-modal Brain MRI Images based on Graph Deep Neural Networks and Attention Mechanism,10.5220/0010214400560066,n/a,Farah I.,VISIGRAPP,2021,Tunisia,0